name,description
Siam Amazing Park – Water World,"Siam Amazing Park in Khan Na Yao is Bangkok’s largest water and amusement park. Its Water World has the Guinness‑record wave pool, family zones, and thrill slides. Facilities include lockers, food courts, and shaded seating. The wider park combines dry rides with themed zones. Tickets are day passes covering multiple areas. Best for full‑day family outings."
Pororo AquaPark Bangkok,"Pororo AquaPark is a rooftop water park at CentralPlaza Bangna. It is themed on the Korean character Pororo with slides, splash areas, and shallow pools. Lifeguards, lockers, and snack stalls are provided. The venue is compact and family‑friendly. Capacity is limited on weekends. Convenient for half‑day mall visits."
Harbor Island – The Mall Bangkapi,Harbor Island is a new rooftop water park at The Mall Lifestore Bangkapi. It focuses on kid‑safe slides and splash zones. Stroller access and family facilities are well planned. It links with indoor play venues in the same complex. Access improved with the Yellow Line BTS. Check weather updates for closures.
Fantasia Lagoon – The Mall Ngamwongwan,"Fantasia Lagoon is a suburban rooftop water park in Nonthaburi. It offers family slides, lazy‑river pools, and kid splash areas. It mainly draws local families on weekends. Facilities include lockers and showers. Easy to combine with mall shopping. Modest prices compared with larger parks."
Flow House Bangkok (FlowRider),"Flow House is an urban surf venue on Sukhumvit Soi 26. It uses a FlowRider machine for bodyboarding and flowboarding. Sessions include gear rental and coaching. A café‑bar overlooks the surf pool. It is central, near BTS Phrom Phong. Best for short sporty visits."
SEA LIFE Bangkok Ocean World,"SEA LIFE beneath Siam Paragon is Bangkok’s main aquarium. Exhibits feature sharks, rays, penguins, and rain‑forest zones. Optional add‑ons include glass‑bottom boat rides. It is fully indoors and air‑conditioned. Convenient via BTS Siam. Online bundles help avoid queues."
Safari World – Marine Park Shows,Safari World’s Marine Park runs dolphin and sea‑lion shows. It is part of the zoo‑safari complex in northeast Bangkok. Seating fills quickly near showtime. Food courts and shaded areas support families. Tickets often bundle both safari and marine zones. Check daily schedules online.
Science Center Aquarium (Ekkamai),The Science Center for Education includes a small aquarium. Displays highlight Thai freshwater and marine species. It is low‑cost and educational. Families often pair it with the planetarium. Located near BTS Ekkamai. Simple exhibits compared with commercial aquariums.
Samut Sakhon Aquarium,This public aquarium southwest of Bangkok is run by the Fisheries Department. It shows regional fish species. Admission is cheap or free. Facilities are simple and aimed at schools. Combine with a coastal day trip. Check hours before travel.
Safari World Indoor Tanks,"Besides shows, Safari World’s Marine Park has small aquarium displays. These are basic tanks with common species. Panels are bilingual Thai‑English. Crowds spike around showtimes. Air‑conditioned halls give relief from heat. They complement rather than replace SEA LIFE."
Safari World Bangkok,"Safari World combines a drive‑through safari with show‑focused Marine Park. Visitors see giraffes, zebras, and big cats. Marine Park hosts dolphin and stunt shows. Feeding decks and photo spots are supervised. It is a large suburban site needing planning. Combo tickets cover both sections."
Queen Saovabha Snake Farm,This Red Cross institute in central Bangkok hosts live snake shows. Visitors learn about venom and antivenom research. Indoor and outdoor serpentariums display species. English talks are scheduled daily. Easily reached near BTS Sala Daeng. It is both educational and thrilling.
Siam Serpentarium,Siam Serpentarium near Suvarnabhumi is a modern snake museum. Immersive exhibits explain biology and habitats. Live snakes are housed in clear serpentariums. It balances entertainment with education. The site is indoors and air‑conditioned. Taxi access is easiest.
Bangkok Butterfly Garden & Insectarium,"Located in Chatuchak’s Rot Fai Park, this domed garden lets visitors walk among butterflies. Exhibits explain insect lifecycles. It is compact and low‑cost. Mornings are best for butterfly activity. Simple facilities are available. Combine with park cycling."
Samut Prakan Crocodile Farm,This long‑running reptile zoo is outside Bangkok. It houses thousands of crocodiles with live shows. Grounds also include other animals. Facilities are basic compared to modern parks. Often combined with Ancient City nearby. Access by taxi or car.
Dream World,Dream World north of Bangkok offers family coasters and themed zones. Areas include Snow Town and Fairy Tale Land. Daily parades and stunt shows run. Food courts and shaded rest areas are available. Popular with Thai families on weekends. At least half a day is recommended.
Siam Amazing Park – Amusement Zone,"Besides water rides, Siam Park has coasters and themed streets. Indoor halls protect from storms. Food is spread through canteens. Pricing bundles water and amusement zones. Suitable for mixed‑age groups. Early starts reduce wait times."
MEGA HarborLand (Mega Bangna),"This huge indoor play park offers slides, climbing nets, and toddler areas. It is air‑conditioned and weather‑proof. Timed sessions manage crowds. Parents can supervise from lounges. Birthday packages are offered. Located inside Mega Bangna mall."
BOUNCE Thailand (EmQuartier),"BOUNCE is a trampoline park in EmQuartier. It has free‑jump mats, dodgeball courts, and performance trampolines. Coaches enforce safety and technique. Grip socks are required. Popular with teens and fitness groups. Fully indoors with online booking options."
Playmondo (CentralWorld),Playmondo is an edutainment playground in CentralWorld. Zones mix climbing with sensory play. Staff supervise age‑based areas. Parents wait in lounges with visibility. Timed sessions control capacity. Birthday bookings are common.
EasyKart RCA,EasyKart runs a central karting track at RCA Plaza. Classes suit kids and adults. Helmets and timing systems are standard. Walk‑in sessions run daily. Group packages are offered. Accessible by taxi from downtown.
IMPACT Speed Park,"Located in Muang Thong Thani, this track uses electric Sodi karts. It is known for pro‑level timing. The lakeside setting is scenic. Corporate events are hosted here. Weather may interrupt sessions. Best reached by taxi or car."
E‑Gokart Monowheel – Chula 28,This central electric kart track near Chulalongkorn suits beginners. Separate kids and adult tracks run. Gear rental is included. Group events are common. Weather can pause racing. Easy access from Siam or National Stadium.
E‑Gokart Monowheel – Central Village,"At the Central Village outlet mall near the airport, this branch offers family karting. Two tracks run for kids and adults. Parking is abundant. Mall dining is nearby. Queues form on weekends. Suits casual racers."
TOPKART Bangkok (Chidlom),TOPKART is a premium indoor kart venue near CentralWorld. Modern karts use electronic timing. The layout is technical but compact. Lounges allow spectators to watch. Advance booking helps evenings. Drivers need closed shoes.
LAZGAM Laser Games,LAZGAM is a black‑light laser tag arena near Asok. Team games run in timed sessions. Fog and neon lighting set the scene. Staff provide safety briefings. Lockers and lounges are available. Weekday afternoons are quieter.
Playsquare Laser Tag (CentralWorld),"Playsquare runs mall‑based arenas, with one at CentralWorld. Sessions are short, energetic rounds. The focus is fun over competition. Kids and adults can join. Birthday packages are common. Easy to combine with shopping."
Combat Zone Seacon,Combat Zone near Seacon Square offers outdoor paintball and BB gun fields. Multiple layouts allow scenario play. Rental gear is available. Referees enforce safety rules. Popular for corporate groups. Weather may pause games.
SPEED Paintball Field,SPEED Paintball Field hosts walk‑in days and tournaments. Layouts change seasonally. Rentals and clinics are offered. Hydration and sun protection are key. Teams scrimmage on weekends. Check social pages for events.
Club 11 BB Gun & Paintball,Club 11 in Rangsit runs BB gun and paintball fields. Staff organize mixed‑level matches. Rentals include markers and protective gear. Facilities are basic. Private cars are best for access. Long sleeves and gloves advised.
