name,description
As.is Coffee Bar (Chinatown),"Intimate, design‑driven coffee bar on Soi Nana Chinatown. Low lighting and concrete textures set a moody tone. Menu favors neat espresso and spirit‑inspired signatures. Bar seating encourages close chat with baristas. Playlists and glassware elevate the experience. Small bites are minimal to keep focus on drinks. Great pre‑bar stop before nearby nightlife. Expect knowledgeable recommendations on beans. A niche pick for design‑minded coffee fans. Compact, atmospheric and quietly confident."
Siam Drip Co. (Siam Square),"Filter‑focused café showcasing hand‑drip methods in central Siam. Single‑origin lineup rotates with seasonal arrivals. Baristas brew to order with visible scales and timers. Clean, bright space suits tasting flights. Light sweets pair without masking flavors. Good teaching spot for pour‑over basics. Foot traffic is steady from the shopping district. Retail beans and papers are easy grab‑and‑go. Expect transparent, well‑timed extractions. A go‑to for manual‑brew fans downtown."
Holmes & Friends (Ari),"Neighborhood café in Ari with warm wood and quiet corners. Menu balances espresso standards and soft desserts. Attentive service and low music encourage longer sits. The crowd is local, creative and laptop‑friendly. Beans from Thai and regional roasters rotate. Simple savory plates support brunch‑length stays. Takeaway is quick during morning rush. Expect mellow energy through the day. A gentle, everyday café for Ari regulars. Consistent, friendly and relaxed."
Na‑Arun Coffee (Old Town),"Small Old Town café near temples with bright, fruity filters. Seats are few, so visits feel personal and calm. Manual brews highlight light roasts and clarity. Simple cakes appear in limited daily batches. Staff chat about origins and processing styles. Great as a pause on Rattanakosin walks. Air‑con gives respite from the mid‑day heat. Payment is quick and mostly cashless. Expect honest cups without frills. A neat, low‑key stop for coffee purists."
Woodbrook Café (Riverside),"A minimalist café tucked near the river with soft light and plants. Menu runs from neat espresso to balanced milk drinks. Window seats are prized for a calm, breezy feel. Baristas prioritize temperature control and texture. Pastries are small but well chosen. A good reading spot away from crowds. Music is gentle; conversations stay hushed. Expect steady regulars and polite service. A restorative stop between riverside strolls. Simple, thoughtful coffee done right."
Karo Coffee Roasters (Ladprao),"Compact roastery‑café in Ladprao with punchy espressos. Signature drinks add citrus, herbs and Thai fruits. Retail shelf features fresh drops weekly. Seating is brief; takeaway moves quickly. Baristas share brew ratios on request. Crowd skews local and repeat‑heavy. Expect a lively bar and quick chats. Parking is limited; rideshares help. A practical stop for beans and shots. Bold flavors in a no‑nonsense space."
Sunday Morning Café (Ari),"Bright, cozy Ari café with an all‑day breakfast tilt. Coffee program is consistent and milk‑friendly. House granola, eggs and toasts please regulars. Plants and light wood keep the room cheerful. Baristas are kind and conversational. Great for a calm, unhurried start. Takeaway cups are sturdy for walks. Expect a neighborly crowd most days. A reliable comfort café in Ari. Simple, good coffee with warmth."
Nikko Café (Ari),Japanese‑inspired neighborhood café with clean lines and soft colors. Coffee leans balanced; desserts are not overly sweet. Seats fill with locals reading or working. Menu includes matcha and light teas. Staff keep things gentle and attentive. A calm contrast to busier nearby spots. To‑go orders are quick and tidy. Expect a soft soundtrack and low voices. A soothing stop on an Ari walk. Minimalist design with friendly touches.
