name,description
Caturday Cat Café,"A beloved cat café next to BTS Ratchathewi with dozens of friendly resident cats. The vibe is playful and cozy, with photo corners and cat towers everywhere. Guests purchase an entry package that includes time with the cats and a drink or dessert. Staff supervise interactions and maintain strict hygiene for animal welfare. It is popular on weekends, so short queues and timed sessions are common. Families and couples come for cute moments and calm, air‑conditioned downtime. Menu highlights include sweet treats, iced drinks and simple café fare. Shoes are removed and hands sanitized before entering the cat zone. Location is inside Coco Walk alley, a few minutes from BTS Ratchathewi. Expect a cheerful, Instagram‑friendly experience focused on cat time."
Mohu Mohu Cat Café,"A small Japanese‑style rescue cat café near Chong Nonsi and Samyan areas. The concept centers on adopting and caring for rescued cats. Guests book or walk in for quiet sessions with gentle, socialized cats. Rules protect the animals; staff guide handling and resting times. Soft music, low seating and simple décor keep the energy calm. Drinks are straightforward; the focus is cat time rather than elaborate food. Community donations and merch often support ongoing rescue care. It suits visitors who prefer a low‑key environment over crowds. Cleanliness and litter‑box separation are maintained throughout the day. A heartfelt stop for cat lovers who value ethical shelters."
Big Dog Cafe,"Bangkok’s famous big‑breed dog café on Ratchadaphisek, known for huskies, malamutes and other gentle giants. Guests join fixed‑time sessions to meet trained dogs supervised by handlers. Brief orientation explains do’s and don’ts before contact begins. Photos are welcome, and staff help line up adorable shots. Entry tickets typically include a drink; snacks are available. The venue prioritizes dog rest cycles and rotation for welfare. Families and friend groups book ahead, especially on weekends. Air‑conditioning and indoor seating make visits comfortable year‑round. Located a short ride from Huai Khwang and Ladprao areas. Ideal for dog lovers seeking a safe, memorable interaction session."
Dog Country Cafe,"A large dog café and pet space on Phutthamonthon Sai 2 catering to all sizes and many breeds. Handlers supervise meet‑and‑greet sessions and guide proper interaction. Timed entry keeps groups manageable and reduces stress on dogs. The café serves simple drinks and snacks alongside the pet activities. Special events and pop‑ups often feature the café’s dogs off‑site. Hygiene protocols and cleaning are visible between waves of guests. Families with kids are welcomed with clear rules and gentle dogs. Expect energetic, playful moments and lots of photo opportunities. Pre‑booking is recommended during holidays and weekends. Come for the cheerful atmosphere and well‑run dog sessions."
Double Dogs Tea Room,"A Chinatown tea institution on Yaowarat specializing in Chinese and Taiwanese teas. The small room hosts calm, serious tea sessions with gongfu‑style brewing. Owners guide guests through oolongs, pu‑er and seasonal limited teas. Tasting flights reveal differences in aroma, body and aftertaste. Minimalist décor and subdued lighting keep attention on the tea. Light snacks pair with the brews without overwhelming flavors. Walk‑ins are possible, but the space fills quickly at peak hours. The venue suits tea lovers who enjoy slow, attentive service. Knowledgeable staff explain origins, harvests and proper steeping. A quiet counterpoint to the bustle of Yaowarat’s street life."
Peace Oriental Teahouse (Sukhumvit 49),"A modern Japanese tea house known for ceremonial‑grade matcha and roasted teas. The counter showcases whisked matcha, usucha and koicha styles. Seasonal gyokuro, genmaicha and premium hojicha round out the menu. Desserts like matcha soft serve complement the tea purity. Minimalist, wood‑and‑stone interiors create a meditative mood. Tea masters prepare bowls precisely and guide flavor notes. Guests can compare ceremonial grades to understand texture and umami. The brand emphasizes provenance and careful sourcing. This Sukhumvit 49 branch is a favorite for quiet afternoon breaks. A refined stop for anyone building a serious matcha palate."
Peace Oriental Teahouse (Velaa Langsuan),"Flagship‑style branch in Langsuan offering the brand’s full ceremonial matcha experience. Design feels serene and contemporary, with pale wood and soft light. Matcha flights allow side‑by‑side tasting of different grades. Roasted tea options highlight nutty, caramelized aromatics. Whisking is done to order, with attention to froth and texture. Staff explain water temperature and whisk technique on request. Light Japanese desserts pair cleanly with the teas. Comfortable seating suits calm conversations and solo tastings. Close to Lumphini and Chit Lom areas for easy access. Ideal for travelers seeking best‑in‑class matcha in Bangkok."
Tealily Matcha House (Ekkamai),"A beloved Japanese matcha café tucked in Ekkamai’s backstreets. Ceremonial matcha, warabi mochi and simple Japanese sweets lead the menu. Small wooden counter and handcrafted ceramics set the tone. Brewing and whisking are precise, gentle and personal. Limited seats keep the atmosphere relaxed and unhurried. Light, not overly sweet desserts respect the tea’s balance. Guests often pair a hot bowl with a refreshing iced matcha. The team takes care to explain grades and flavor differences. It feels like a tiny Tokyo tea stop transplanted to Bangkok. Come early for quiet moments and attentive service."
Hario Cafe (Thonglor),"Showcase café from the Japanese brewing brand, popular with coffee enthusiasts. Baristas brew pour‑overs with V60 and siphon using single‑origin beans. Workshops and retail shelves highlight kettles, scales and drippers. Minimalist Japanese design keeps focus on technique and clarity. Menu balances filter coffee, espresso and light sweets. Guests can compare grind sizes and extraction styles by cup. Great for gear‑curious home brewers upgrading their setup. Staff discuss water temperature, flow control and recipe ratios. Located in the Thonglor/Sukhumvit corridor for easy café hopping. A hands‑on stop to deepen coffee skills with precise tools."
% Arabica (ICONSIAM),"Bangkok branch of the Kyoto‑born brand with iconic % signage and clean lines. Single‑origin espresso and signature Spanish latte draw steady queues. Baristas dial in shots with consistent, balanced profiles. The counter design emphasizes transparency and speed. Beans rotate seasonally with clear tasting notes. Large windows and river views create a sleek pause point. Menu is focused and minimalist, ideal for quick excellence. Fans appreciate the global consistency across branches. ICONSIAM location pairs a coffee stop with mall exploration. A reliable boutique option for precise espresso drinks."
BOYY & SON Café (Gaysorn),"Designer café by Thai luxury label BOYY inside Gaysorn Village. Interiors echo the brand’s leather‑goods aesthetic in calm neutrals. Coffee is paired with a tight menu of pastries and light plates. Service is polished, matching the boutique retail environment. A good stop for fashion‑minded guests between errands. Ambient music and soft lighting make it linger‑friendly. Seating suits small meetings and relaxed solo breaks. The counter focuses on espresso and simple filter brews. It feels more like a salon than a traditional café. Great for a refined coffee break in Ratchaprasong."
Featherstone Bistro & Café (Ekkamai),"A whimsical, vintage‑apothecary‑themed café and bistro in Ekkamai. Stained glass, curios and dried flowers set an imaginative mood. Colorful sodas, coffee and all‑day plates anchor the menu. Desserts and ice‑cream sodas add nostalgic fun to the visit. Tables are spaced for conversations and extended hangs. Popular for birthdays, casual dates and photo lovers. Reservation helps at dinner and on weekends. Service is friendly and timing is unhurried. Expect a transportive, storybook vibe throughout. Come for playful aesthetics and easy comfort food."
Blue Whale Maharaj,"Tiny, photogenic café near Wat Pho known for its ‘blue latte’ using butterfly pea. Narrow stairs lead to compact seating across multiple floors. Natural light and sea‑blue paint make every corner camera‑ready. Menu features coffee, tea and a handful of simple plates. The signature latte tastes gentle, floral and lightly sweet. It is a popular stop after temple visits in the Old Town. Service is quick; turnover keeps the line moving. Expect a youthful, traveler‑friendly crowd during the day. Cashless payments are widely accepted at the counter. A classic for first‑time café‑hoppers in Phra Nakhon."
Wallflowers Café (Chinatown),"A beloved floral café on Soi Nana in Chinatown with a secret‑garden feel. Dried flowers and rustic textures set a romantic atmosphere. Cakes and coffee come with artful plating and gentle sweetness. The space connects to Wallflowers Upstairs, a sister bar. Daytime is calm and cozy; nights turn livelier next door. Photogenic nooks reward slow, unhurried visits. Staff are welcoming and used to photo‑happy guests. Great before or after a Chinatown food crawl. Seating is limited; arrive early on weekends. A crossover of café culture, floristry and vintage charm."
Oneday Wallflowers (Flower Shop & Café),"A flower shop turned café space associated with the Wallflowers cluster. Fresh bouquets, dried arrangements and sweets share the stage. Guests browse blooms while sipping coffee or tea. Light bites accompany a short list of drinks and cakes. The vibe is romantic, textured and softly lit. Expect many photo spots and creative set‑ups. Service is relaxed and unhurried in the floral rhythm. Ideal for gifting moments or quiet afternoon breaks. Links easily with other stops on Soi Nana Chinatown. A gentle, garden‑like pause in the city."
Gallery Drip Coffee (BACC),"Bangkok Art & Culture Centre’s longtime specialty coffee bar. Manual‑brew specialists serve single‑origin filter coffees. Beans are roasted with clarity and clean flavor goals. Art books, zines and ceramics complement the creative setting. Baristas discuss roast profiles and brewing recipes on request. Seating is casual, with museum‑goers drifting in and out. Pour‑over flights help compare origins and processes. This is a community hub for artists and coffee geeks alike. Great as a mid‑gallery break or focused tasting stop. An anchor of Bangkok’s third‑wave scene for years."
Roots at theCOMMONS (Thonglor),"Flagship branch of a Thai specialty roaster inside the Thonglor hub. The stall serves espresso, cold brew and seasonal Thai‑inspired drinks. Beans are sourced transparently from Thai and global farms. Simple pastries and ice‑cream sandwiches pair with coffee. A mezzanine seating area overlooks the lively courtyard. Ordering is fast and mobile‑friendly for regulars. Rotating signature drinks show playful, local flavors. Good for quick stops during market or brunch runs. A dependable anchor for café‑hopping in theCOMMONS. Consistent quality and friendly, efficient service."
Roots at Sathon,"A calm, neighborhood branch of the respected Thai roaster. Counter service emphasizes espresso and seasonal filters. Retail beans and gear are available for home brewers. Clean, wooden interiors keep the space warm and minimal. Menu includes easy pastries and ice‑cream sandwiches. Baristas are happy to suggest beans for your taste. Popular with office workers and weekend regulars. Seating fits short meet‑ups and solo work sessions. Expect steady, balanced extractions and clear flavor. A reliable daily coffee stop in Sathon."
Factory Coffee (Phaya Thai),"Award‑winning Bangkok coffee team known for competition‑grade beverages. The Phaya Thai café pours precise espresso with bold, clean flavors. Signature drinks and special lots appear throughout the year. Baristas explain origins, processes and extraction targets. Minimal‑industrial interiors keep focus on the cup. The brand also runs a roastery HQ elsewhere in Bangkok. Takeaway moves quickly in the morning rush. Seating supports short work sessions between trains. Expect excellence without unnecessary fuss. A must‑visit for serious espresso and signature builds."
Kaizen Coffee (Ekkamai),"Modern Australian‑leaning café with strong espresso and brunch plates. Sleek, bright interiors suit laptops and quick meetings. Menu runs from flat whites to thoughtful filter options. Food balances comfort with clean presentation and produce. Latte art and consistent extractions show tight training. Retail beans and gear are stocked for home setups. Baristas engage kindly with questions about recipes. Expect a steady local crowd on weekends. Location is walkable from Ekkamai’s main stretch. A polished all‑rounder for coffee and brunch."
La Cabra (Talad Noi),"Danish specialty roaster’s first Thailand outpost in historic Talad Noi. Scandinavian minimalism meets preserved, raw‑edge townhouse details. Menu spotlights clean espresso and filter with distinct clarity. Pastries lean Danish, with laminated favorites and seasonal items. Standing bar and simple seating encourage focused tasting. Beans and merchandise are displayed with gallery‑like restraint. Staff keep service warm, precise and quietly informative. The setting pairs well with a Talad Noi art walk. Expect a calm, light‑filled room and crisp brews. A benchmark for Nordic‑style coffee in Bangkok."
La Cabra (Silom Bakery),"Bakery‑led sibling of the Talad Noi café with strong coffee support. Morning lines form for laminated pastries and seasonal bakes. Espresso and batch brew stay clean and balanced. Neutral interiors and display cases create a calm rhythm. Menu clarity and portion sizes suit everyday stops. Friendly staff help with pairing suggestions for drinks. Popular with office crowds and weekend pastry runs. Takeaway packaging keeps items crisp for travel. Great gateway to La Cabra beans and style. Plan for a quick, delicious pastry‑and‑coffee stop."
Sarnies Bangkok (Charoen Krung),"Singapore‑born roastery and café inside a restored shophouse. Hearty sandwiches, brunch plates and specialty coffee anchor the menu. Industrial‑rustic interiors feel warm and unpretentious. Seasonal drinks riff on local fruits and spices. Crowds ebb and flow with nearby art events and riverside walks. Retail beans, cascara and brewing gear line the shelves. A good base for exploring Charoen Krung’s creative scene. Service is upbeat and efficient despite queue swings. A versatile stop for both coffee and real food. Reliable, all‑day energy in a characterful neighborhood."
Ink & Lion Café (Ekkamai),"A minimalist Ekkamai classic focused on calm, quality coffee. White walls, wood benches and curated records set the tone. Filter menu changes with fresh seasonal beans. Espresso runs clean, with balanced milk drinks. Baristas share brewing specs if you are curious. Retail shelves carry beans and small accessories. The room suits quiet reading and solo sessions. A steady neighborhood favorite for years. Expect understated hospitality and attention to detail. Come for honest cups without distractions."
Patom Organic Living (Sukhumvit 49),"A serene glass‑house café set in a leafy compound off Sukhumvit 49/6. Organic drinks and snacks use produce from the brand’s own farm. The design brings sunlight, greenery and reclaimed wood together. Reusable packaging and low‑waste habits reflect the ethos. Calm music and garden views promote slow pauses. Families, freelancers and design lovers share the space. Retail shelves stock body care and pantry items. Seasonal beverages spotlight Thai herbs and fruits. It feels restorative after busy Sukhumvit errands. A gentle, eco‑minded café for mindful breaks."
Pacamara Coffee Roasters (Thonglor),"Thai roaster with a precise espresso program and tidy interior. Baristas pull stable shots with chocolate‑nutty profiles. Filter offerings rotate through Thai and imported beans. Desserts and toasts round out an easy café menu. Seats fit short meetings, solo work and quick stops. Retail beans and drip kits are available at the counter. Service is brisk and professional during rush hours. Music stays low for comfortable conversations. A dependable Thonglor option with long‑time fans. Great for a straightforward, well‑made coffee."
Toby’s (Thonglor),"Australian‑style café known for bright brunch plates and smooth espresso. The interior is sunny, plant‑filled and relaxed. Flat whites, cold brew and fresh juices headline the drinks. Egg dishes and pancakes are crowd favorites at peak times. Service is friendly and timing is efficient. Families and groups often gather on weekends. Expect a cheerful hum and steady table turns. The location works well for café‑hopping nearby. A dependable pick for brunch plus coffee in Thonglor. Comforting, well‑presented plates match the easy vibe."
One Ounce for Onion (Ekkamai),"A coffee bar inside ONION’s lifestyle boutique on Ekkamai Soi 3. Menswear, magazines and coffee blend into one creative space. The bar serves classic espresso drinks and simple filters. Soundtrack and retail browsing add to the experience. Small tables and a counter suit short breaks. Fashion fans drop in between fittings and errands. Expect a low‑key, friendly service rhythm. Retail and café hours align for easy access. Good for a quick caffeine stop with style. A neat crossover of coffee and design retail."
Brave Roasters (Siam Discovery),A specialty coffee bar inside Siam Discovery with a modern aesthetic. Espresso and creative signatures share equal billing. Beans include Thai microlots and international origins. The counter is compact and efficient for mall traffic. Seating nearby works for quick chats and shopping breaks. Staff are upbeat and used to first‑time coffee explorers. Retail shelves sell beans and basic brew tools. Expect reliable extractions and bright milk drinks. Great for caffeine between Siam’s major malls. A convenient central stop with quality coffee.
Red Diamond Café (Lat Phrao),"Cult‑favorite roaster known for vivid signature drinks and serious espresso. The Lat Phrao café leans industrial with bar seating up front. Rotating beans and flavor‑forward creations draw regulars. Baristas keep a playful but precise approach at the bar. To‑go service is quick for commuters. Retail beans and seasonal bottles line the shelves. Expect strong flavors and photogenic pours. Parking and seating vary by time of day. Worth a detour for bold, distinctive profiles. A staple name in Bangkok’s specialty scene."
Ceresia Coffee Roasters (Phrom Phong),"Family‑run roastery and café tucked near Sukhumvit 33. Menu focuses on clean espresso and approachable filters. House roasts aim for balance and sweetness over extremes. Minimal décor keeps attention on the cup and service. Regulars pick up beans alongside morning coffee. Friendly baristas share simple home‑brew tips. Seating suits quick stops and relaxed conversations. A quiet counterpoint to busier nearby cafés. Reliable, gentle‑toned cups for everyday drinking. A neighborhood favorite for years."
Hands and Heart (Thonglor),"Monochrome, minimalist coffee bar known for precise pour‑overs. White‑and‑black interiors create a serene stage for coffee. Light, medium and dark filters rotate as beans change. Espresso program stays clean with tidy milk texture. The team shares brew specs if you are curious. A few bar seats encourage focused tastings. Retail shelves carry drippers and scales. Expect soft music and a contemplative mood. The shop suits brief, intentional coffee breaks. Great for design lovers who value clarity."
NANA Coffee Roasters (Ari),A greenhouse‑like garden café in Ari from the acclaimed Thai roaster. Signature drinks and creative brunch draw steady crowds. Single‑origin choices range from Thai lots to global beans. Natural light and wood keep the room bright and calm. Pastries and plated dishes make it a destination café. Baristas communicate clearly even during rushes. Retail beans and capsules are available to take home. Queues move briskly; earlier visits feel more relaxed. Ari’s creative vibe fits the brand’s style perfectly. A must for visually striking space plus quality coffee.
The Blooming Gallery (EmQuartier),"A floral‑themed tea and dessert café inside EmQuartier. Botanical décor and soft colors set a dreamy tone. Cakes, tarts and tea concoctions headline the menu. Seasonal items play with fruits, flowers and herbs. Service is gentle, with attention to presentation. Seating suits catch‑ups and celebration treats. Expect lines during peak shopping hours. Photogenic plating rewards patient sweet‑tooths. A romantic stop between mall errands. Best for dessert‑first moods with tea on the side."
Divana Signature Tea House (EmQuartier),"A refined tea salon from the spa brand with Thai‑inspired blends. Afternoon tea sets feature delicate sweets and savories. Aromatics play with jasmine, lemongrass and tropical fruits. Elegant interiors echo the brand’s wellness roots. Service is polished and timing is unhurried. Guests linger over multi‑tier stands and hot pots. Good for small celebrations and gentle conversations. Staff happily guide newcomers through blends. Located inside a central mall for easy access. A spa‑adjacent tea escape with local notes."
CHATA Specialty Coffee (Old Town),A photogenic café in a restored Sino‑Thai house near Wat Suthat. Tall glass roof floods the room with natural light. Menu leans to clean espresso and bright filter profiles. Signature drinks use Thai herbs and seasonal fruits. Pastries and light plates fit leisurely afternoons. Design details highlight reclaimed wood and brick. A favorite for architecture and coffee photography. Staff keep the flow smooth during photo rushes. Works well as a stop on an Old Town wander. Expect calm music and a golden afternoon glow.
Elefin Coffee (Rattanakosin),"Thai coffee brand with a café near the Grand Palace area. Menu features Thai single‑origin beans and classic espresso. Simple plates and Thai desserts pair with drinks. Air‑conditioned seating gives respite from the heat. Staff handle tourists kindly and efficiently. Beans and gifts make easy take‑home souvenirs. Great for fueling up during temple days. Prices stay moderate given the location. A practical, friendly specialty stop in Old Town. Consistent and convenient for heritage walks."
Luka (Sathorn),"A stylish café‑bistro in a converted shophouse on Pan Road. Comfort plates, salads and quality coffee form the core. Warm wood and soft lighting create a homey feel. Service is attentive, with timing good for business lunches. Desserts rotate with seasonal inspiration. Expect a mix of locals and travelers in the room. Takeaway coffees are steady during morning rush. Seating supports laptops between meetings. Reliable for both brunch and afternoon breaks. A neighborhood staple with friendly polish."
Luka Moto (Thonglor),"A collaboration café with a motorcycle‑lifestyle concept store. Espresso drinks, burgers and salads share the menu. Industrial‑retro décor frames bikes and gear displays. Music skews upbeat, giving the space an energetic mood. Bar seats and tables work for short hangs. Service is brisk and cheerful. Good for casual meet‑ups with a design twist. Parking and access are straightforward for Thonglor. Expect a lively, stylish café‑retail crossover. A fun detour for café‑hopping in Sukhumvit."
Roast (theCOMMONS Thonglor),"Brunch‑forward café‑restaurant with a dedicated coffee program. Espresso is well dialed, and filter options appear seasonally. Menu includes eggs, pasta, salads and pastries. Bright, open seating overlooks theCOMMONS courtyard. Service is efficient despite constant foot traffic. Retail coffee and desserts make easy takeaways. Works for groups and long catch‑ups. A polished anchor of the Thonglor café circuit. Expect consistent execution and balanced cups. Great when you need both real food and coffee."
Mother Roaster (Talad Noi),A characterful roastery‑café in Talad Noi with a cult following. The entrance hides a bright second‑floor bar and seating. Manual brews and espresso showcase careful roasting. Industrial details echo the neighborhood’s old garages. Staff guide tasting choices for curious visitors. Beans and drippers are available for home setups. Good pairing with a street‑art walk in the area. Expect lines at peak times; turnover is steady. Service stays friendly even during photo rushes. A memorable stop for coffee lovers exploring Chinatown.
Bluekoff Flagship (Bangna),"Bangkok roaster’s flagship with a training lab and gear retail. Menu covers espresso, pour‑over and seasonal signature drinks. Baristas teach basics to home brewers in short workshops. Clean, modern interiors keep focus on technique. Retail wall stocks grinders, kettles and scales. Parking and access suit quick coffee supply runs. Crowd mixes café‑goers and coffee pros. Expect stable extractions and clear tasting notes. A practical stop for upgrading home coffee gear. Strong choice for serious coffee in Bangna."
